id,skill
509,Advise others on career or personal development
510,Update professional knowledge
511,"Conduct research to inform art, designs or other work"
512,Develop professional relationships or networks
513,Review professional literature to maintain professional knowledge
514,Attend training sessions or events to develop or maintain professional knowledge
515,Attend events to develop professional knowledge
516,Study product information to acquire professional knowledge
517,Conduct research to increase knowledge about medical issues
518,Maintain medical or professional knowledge
519,Update technical knowledge
520,Update knowledge or skills
521,Maintain professional knowledge or certifications
522,Attend training to learn new skills or update knowledge
523,Train others on performance techniques
524,Maintain current knowledge related to work activities
525,Review laws or regulations to maintain professional knowledge
526,Stay informed about current developments in field of specialisation
527,Maintain professional social services knowledge
528,Attend conferences or workshops to maintain professional knowledge
529,Attend educational events to update medical knowledge
530,Advise others on legal or regulatory compliance matters
531,Collaborate with other law enforcement or security agencies to share information
532,Collaborate with law enforcement or security agencies to respond to incidents
533,Relay information about incidents or emergencies to personnel using phones or two-way radios
534,Inform others about laws or regulations
535,Analyse impact of legal or regulatory changes
536,Draft legislation or regulations
537,Prepare proposals or grant applications to obtain project funding
538,Prepare forms or applications
539,Write grant proposals
540,Prepare proposal documents or grant applications
541,"Prepare contracts, disclosures or applications"
542,Prepare proposal documents
543,"Prepare drafts of amendments, government policies, laws, rules, regulations, budgets, programs and procedures"
544,Present information to the public
545,"Inform viewers, listeners or audiences"
546,Report news to the public
547,Provide educational information to the public
548,Present business-related information
549,Provide information to the general public
550,Present social services program information to the public
551,Provide educational materials to community members
552,Maintain operational records
553,Inspect operational processes
554,Maintain operational records or records systems
555,Record operational or production data
556,Prepare reports related to compliance matters
557,Obtain documentation to authorise activities
558,Complete documentation required by programs or regulations
559,"Explain regulations, policies or procedures"
560,"Prepare documentation for contracts, transactions or regulatory compliance"
561,Review license or permit applications
562,Verify application data to determine program eligibility
563,Review documents or materials for compliance with policies or regulations
564,Coordinate regulatory documentation activities
565,Prepare regulatory or compliance documentation
566,Maintain data in information systems or databases
567,"Maintain records, documents or other files"
568,Maintain inventory records
569,Record staff information
570,File documents or records
571,Store records or related materials
572,Maintain call records
573,Maintain logs of production activities
574,Assess database performance
575,Record production information
576,Record personnel information
577,Maintain personnel records
578,Prepare analytical reports
579,Write reports or evaluations
580,Prepare research reports
581,Prepare data for analysis
582,Prepare investigation or incident reports
583,Convert data among multiple digital or analogue formats
584,"Edit audio, photographs or video recordings"
585,Download data
586,Retrieve information from electronic sources
587,"Format digital documents, data or images"
588,Review audio or video recordings
589,"Deliver, publish, broadcast or distribute final audio or visual media product"
590,Write informational material
591,"Send information, materials or documentation"
592,Edit written materials
593,Edit documents
594,Compile data or documentation
595,Transcribe spoken or written information
596,Type documents
597,Monitor current trends
598,Analyse information obtained from news sources
599,Gather information for news stories
600,Search information sources to find data
601,"Search files, databases or reference materials to obtain information"
602,Observe individuals' activities to gather information or compile evidence
603,Use databases to locate investigation details or other information
604,Analyse website or related online data to track trends or usage
605,Communicate with constituents and keep abreast of the issues affecting them
606,Maintain knowledge of relevant national and international current events
607,Research topics in area of expertise
608,"Write articles, books or other materials"
609,Conduct anthropological or archaeological research
610,Prepare scientific or technical reports or presentations
611,Research hydrologic features or processes
612,Read documents to gather technical information
613,Review technical documents to plan work
614,Prepare research or technical reports
615,Prepare technical reports for internal use
616,Organise informational materials
617,Prepare graphics or other visual representations of information
618,Update website content
619,Prepare informational or reference materials
620,Publish content on digital platforms or social media sites
621,Develop social media materials
622,Maintain records of customer accounts
623,Maintain client records
624,Maintain client information or service records
625,Maintain surveillance of individuals or establishments
626,Inform individuals or organisations of status or findings
627,Maintain social services program records
628,Verify patron or staff credentials
629,Identify implications for cases from legal precedents or other legal information
630,Prepare documentation of legal proceedings
631,Prepare legal documents
632,Prepare written decisions for legal proceedings
633,Rule on admissibility of legal proceedings
634,Record information from meetings or other formal proceedings
635,Record information about legal matters
636,Prepare legal or investigatory documentation
637,Prepare information or documentation related to legal or regulatory matters
638,Serve court ordered documents
639,Document information related to legal proceedings
640,Research engineering aspects of biological or chemical processes
641,Research advanced engineering designs or applications
642,Research engineering applications of emerging technologies
643,Research human performance or health factors related to engineering or design activities
644,Interpret cultural or religious information
645,Manage construction activities
646,Estimate technical or resource requirements for development or production projects
647,Mark reference points on construction materials
648,Select production input materials
649,Estimate materials requirements for projects
650,Select construction materials
651,Estimate material requirements for production
652,Monitor resources
653,Cut materials according to specifications or needs
654,Mix ingredients to create specific finishes
655,Select production equipment according to product specifications
656,"Mark products, work pieces or equipment with identifying information"
657,Measure ingredients or substances to be used
658,"Calculate specific material, equipment or labour requirements"
659,Evaluate quality of materials or products
660,"Construct distinctive physical objects for artistic, functional or commercial purposes"
661,Classify materials according to standard systems
662,Test quality of materials or finished products
663,Test chemical or physical characteristics of materials or products
664,Compare physical characteristics of materials or products to specifications or standards
665,Examine physical characteristics of gemstones or precious metals
666,Weigh materials to ensure compliance with specifications
667,Compact or smooth materials to create level bases
668,Mark materials or objects for identification
669,Test characteristics of materials or structures
670,"Calculate weights, volumes or other characteristics of materials"
671,Determine metal production methods
672,Determine plastic or rubber production methods
673,Determine presentation subjects or content
674,Select project materials
675,Determine how best to represent a concept visually
676,Install insulation in equipment or structures
677,Lubricate production equipment
678,Demonstrate activity techniques or equipment use
679,"Set equipment guides, stops, spacers or other fixtures"
680,Install gauges or controls
681,Determine production equipment settings
682,Apply solutions to production equipment
683,Align parts or work pieces for assembly
684,Heat material or work pieces to prepare for or complete production
685,Lay out parts to prepare for assembly
686,Cut industrial materials in preparation for fabrication or processing
687,Adjust position of moulds during processing
688,"Melt metal, plastic or other materials to prepare for production"
689,Grind parts
690,Reshape metal work pieces to established specifications
691,Prepare materials for processing
692,Prepare products for testing
693,Read technical information needed to perform maintenance or repairs
694,Evaluate characteristics of individuals to determine needs or eligibility
695,Recommend legal actions
696,Read materials to determine needed actions
697,Analyse shipping information to make routing decisions
698,Read maps to determine routes
699,Examine marketing materials to ensure compliance with policies or regulations
700,Evaluate civic projects or public policies
701,Analyse and understand the local and national implications of proposed legislation
702,Analyse energy usage data
703,"Create graphical representations of structures, landscapes or aquatic systems"
704,"Create images of data, locations or products"
705,Create images or other visual displays
706,Coordinate special events or programs
707,Manage outreach activities
708,Organise special events
709,Coordinate artistic activities
710,"Promote products, activities, or organisations"
711,Coordinate student extracurricular activities
712,Plan special events
713,Conduct amusement or gaming activities
714,Organise recreational activities or events
715,Coordinate athletic or sporting events or activities
716,Host events
717,Accompany individuals or groups to activities
718,Determine methods to minimise environmental impact
719,Participate in or lead outdoor adventure activities
720,"Determine equipment, food and supplies required for journey"
721,Participate in athletic events
722,"Perform swimming, diving, or aquatic activities"
723,Practice athletic or artistic skills
724,Participate in physical training to maintain fitness
725,Develop exercise or conditioning programs
726,"Advise athletes, coaches, or trainers on exercise regimens, nutrition, or equipment use"
727,"Promote goods, services, or programs"
728,Create marketing materials
729,Obtain information about goods or services
730,Develop promotional materials
731,Sell goods or services
732,Set up merchandise displays
733,"Market goods, services or events"
734,Perform marketing activities
735,Demonstrate products to consumers
736,Develop promotional strategies or plans
737,Write advertising or promotional material
738,Explain use of goods or services
739,Arrange items for use or display
740,Implement advertising or marketing initiatives
741,"Sell motor vehicles, caravans or automotive products"
742,Develop marketing plans or strategies
743,Coordinate sales campaigns
744,Develop marketing plans or strategies for environmental initiatives
745,Merchandise health care goods or services
746,Schedule release of marketing content
747,Maintain records of sales or other business transactions
748,Monitor sales activities
749,Review accuracy of sales or other transactions
750,Process sales or other transactions
751,Record sales or transactions data
752,Share sales-related or market information with colleagues
753,Contact current or potential customers to promote goods or services
754,Deliver promotional presentations to current or prospective customers
755,Develop content for sales presentations or other materials
756,Distribute promotional literature or samples to customers
757,Identify potential customers
758,Discuss goods or services information with customers or patrons
759,Develop proposals for current or prospective customers
760,Visit establishments to evaluate needs or to promote products or service sales
761,"Provide basic information to guests, visitors, or clients"
762,Communicate organisational information to customers or other stakeholders
763,Collect data about customer needs
764,Resolve customer complaints or problems
765,Answer customer questions about goods or services
766,"Greet customers, patrons or visitors"
767,Correspond with customers to answer questions or resolve complaints
768,Present work to clients for approval
769,Advise customers on the use of goods or services
770,Gather customer or product information to determine customer needs
771,Recommend goods or services to customers
772,Provide transportation information to passengers or customers
773,Collect information about clients
774,Confer with customers or users to assess problems
775,"Communicate with clients about products, procedures and policies"
776,Communicate with customers to resolve complaints or ensure satisfaction
777,Discuss service options or needs with clients
778,Document client health or progress
779,Respond to customer inquiries
780,Take customer orders
781,Provide customers with general information or assistance
782,Gather information in order to provide services to clients
783,Respond to customer problems or complaints
784,Answer telephones to direct calls or provide information
785,Provide notifications to customers or patrons
786,Issue documentation or identification to customers or employees
787,Refer customers to appropriate staff
788,Take product orders
789,Schedule appointments with prospective customers
790,Present sustainable goods or services information to the public
791,Provide customer service to clients or users
792,Train customers in the use of products
793,Measure clients to ensure proper product fit
794,"Inform the public about policies, services or procedures"
795,Review customer information
796,Issue certificates or licenses
797,Assist individuals with paperwork
798,Assist customers with product selection
799,Explain use of products or services
800,Manage guest services
801,Usher patrons to seats or exits
802,Assist customers with seating arrangements
803,Distribute resources to patrons or employees
804,Arrange services or reservations for patrons
805,"Make travel, accommodation or entertainment arrangements for others"
806,Handle luggage or other possessions for patrons
807,Assist patrons with entering or exiting vehicles or other forms of transportation
808,Guide patrons on tours
809,Provide attraction or event information to patrons
810,Provide patrons with directions to locales or attractions
811,"Advise and answer questions on historically, culturally or environmentally relevant local interest points"
812,Compute gaming wins and losses
813,Conduct gaming transactions
814,Operate gaming equipment
815,Manage environmental sustainability projects
816,Develop environmental remediation or protection plans
817,Evaluate green operations or programs for compliance with standards or regulations
818,Evaluate environmental impact of operational or development activities
819,Identify environmental concerns
820,Develop environmental sustainability plans or projects
821,Promote environmental sustainability or conservation initiatives
822,"Review environmental permits, plans or reports"
823,Review plans or proposals for environmental conservation
824,Direct natural resources management or conservation programs
825,Plan natural resources conservation or restoration programs
826,Develop plans to manage natural or renewable resources
827,Evaluate environmental or sustainability projects
828,Maintain operational records for green energy processes or other environmentally sustainable activities
829,Design water conservation systems
830,Investigate the environmental impact of projects
831,Design environmental control systems
832,Direct environmental development activities
833,Monitor environmental impacts of production or development activities
834,Inspect landscaping to determine treatment needs
835,Undertake natural conservation or restoration activities
836,Analyse risks related to investments in green technology
837,"Train employees on environmental awareness, conservation or safety topics"
838,Supervise workers performing environmentally sustainable activities
839,Teach safety standards or environmental compliance methods
840,Research issues related to the environment or sustainable business practices
841,Research impacts of environmental conservation initiatives
842,Conduct research of processes in natural or industrial ecosystems
843,Communicate results of environmental research
844,Locate natural resources using geospatial or other environmental data
845,Compile environmental or climate data
846,Plan environmental research
847,Prepare research or technical reports on environmental issues
848,Research environmental impact of industrial or development activities
849,Apply knowledge or research findings to address environmental problems
850,Conduct climate research
851,Develop environmental research methods
852,Analyse environmental data
853,Evaluate logistics methods to reduce environmental impact
854,Implement transportation changes to reduce environmental impact
855,Determine methods to minimise environmental impact of activities
856,Appraise environmental impact of regulations or policies
857,Identify opportunities for green initiatives
858,Incorporate green features into the design of structures or facilities
859,Design energy efficient equipment or systems
860,Research design or application of green technologies
861,Install metering equipment
862,"Develop operating strategies, plans or procedures for green or sustainable operations"
863,Test green technologies or processes
864,Evaluate the characteristics of green technologies
865,Install green plumbing or water handling systems
866,Test green technology installations to verify performance
867,Operate energy distribution equipment
868,Operate natural gas distribution equipment
869,Analyse risks to minimise losses or damages
870,Measure environmental characteristics
871,Inspect cargo to identify potential hazards
872,Monitor surroundings to detect potential hazards
873,Monitor activities affecting environmental quality
874,Inspect areas for compliance with sanitation standards
875,Collect environmental data or samples
876,Inspect condition of natural environments
877,Test facilities for environmental hazards
878,Record operational or environmental data
879,Test fluids to identify contamination or other problems
880,Monitor environment to ensure safety
881,Record information about environmental conditions
882,Investigate accidents to determine causes
883,Recommend improvements to increase safety or reduce risks
884,Monitor environmental conditions to detect hazards
885,Patrol natural areas to ensure safety or enforce regulations
886,Maintain practical knowledge of natural areas
887,Safely move and store dangerous goods
888,Recommend changes or corrective procedures
889,Communicate with the public on environmental issues
890,Advise others about environmental management or conservation
891,Advise others about land management or conservation
892,Advise others regarding green practices or environmental concerns
893,"Perform manual agricultural, aquacultural or horticultural tasks"
894,Develop agricultural methods
895,Research crop management methods
896,Research sustainable agricultural processes or practices
897,Evaluate quality or condition of plants or crops
898,Prepare land for agricultural use
899,Identify plant species and features
900,Inspect agricultural products or produce
901,Manage agricultural or forestry operations
902,Mark agricultural or forestry products for identification
903,Measure physical characteristics of forestry or agricultural products
904,Operate farming or agricultural equipment
905,Load agricultural or forestry products for shipment
906,"Maintain forestry, hunting or agricultural equipment"
907,Sort forestry or agricultural materials
908,Record agricultural or forestry inventory data
909,Determine forestry techniques or methods
910,Operate forestry equipment
911,Grade or classify agricultural produce
912,Employ appropriate wool or fleece handling techniques
913,"Assess characteristics of wool, fleece, hair or hide"
914,"Select or maintain hair, wool or fur cutting equipment"
915,Classify organisms based on their characteristics or behaviour
916,Examine characteristics or behaviour of living organisms
917,Cultivate land
918,Package agricultural products for shipment or further processing
919,Harvest agricultural products
920,Sell agricultural products
921,"Advise others on farming or forestry operations, regulations or equipment"
922,"Direct activities of agricultural, forestry or fishery employees"
923,Promote agricultural or hunting activities
924,"Train workers in farming, forestry, or hunting techniques"
925,"Estimate labour or resource requirements for forestry, fishing or agricultural operations"
926,"Examine animals to detect illness, injury or other problems"
927,Perform animal breeding procedures
928,Treat animal injuries or illnesses
929,Treat skin cuts
930,Cut meat products
931,Process animal carcasses
932,Slaughter animals
933,Remove skin or other body parts from animals
934,"Package meat, poultry or seafood"
935,Prepare or process fish or seafood
936,Care for animals
937,Train animals
938,Research livestock management methods
939,Check physical condition of people or animals
940,Monitor health or behaviour of animals
941,Assist with handling of horses
942,Comply with industry animal welfare requirements
943,Handle and safely restrain animals for grooming or shearing
944,"Trim, shear or remove wool, fleece or hair from animals"
945,"Cultivate and maintain lawns, plants and gardens"
946,"Irrigate lawns, trees or plants"
947,Plant greenery to improve landscape appearance
948,Treat greenery or surfaces with protective substances
949,Trim trees or other vegetation
950,Apply chemical solutions to plants for protection or to enhance growth
951,"Plant crops, trees or other plants"
952,Control plant pests or diseases
953,Prepare areas for landscape construction and set up landscape features
954,Design and plan outdoor layouts
955,Capture or kill animals
956,Locate animals for fishing or hunting purposes
957,Plan trapping or hunting activities
958,Position animal trapping or capture equipment
959,Treat facilities to eliminate pests
960,"Inspect condition, or functioning, of facilities or equipment"
961,Inspect aircraft or aircraft components
962,Monitor engine operation or functioning
963,Test performance of aircraft equipment
964,Calibrate scientific or technical equipment
965,Maintain electronic equipment
966,Evaluate characteristics of equipment or systems
967,"Test performance of electrical, electronic, mechanical, or integrated systems or equipment"
968,Test electrical equipment or systems to ensure proper functioning
969,Conduct test runs of production equipment
970,Inspect industrial or commercial equipment to ensure proper operation
971,Monitor equipment operation to ensure no flaws
972,Adjust equipment for optimal performance
973,Test electrical circuits or components for proper functioning
974,Analyse test or performance data to assess equipment operation
975,Inspect telecommunications equipment to identify problems
976,Lubricate equipment to allow proper functioning
977,Test communications equipment to ensure proper functioning
978,Monitor equipment operation to ensure proper functioning
979,Assess equipment functioning
980,Maintain equipment or systems to ensure proper functioning
981,Inspect equipment to ensure proper functioning
982,Inspect equipment to ensure safety or proper functioning
983,Watch equipment in operation to detect malfunctions
984,Inspect production equipment
985,Inspect material-moving equipment to detect problems
986,Test mechanical systems to ensure proper functioning
987,Test mechanical equipment to ensure proper functioning
988,Conduct validation tests of equipment or processes
989,Inspect equipment or systems
990,Measure equipment outputs
991,Observe equipment in operation to detect potential problems
992,Inspect communications or broadcasting equipment
993,Inspect equipment to locate or identify electrical problems
994,Maintain sustainable energy production equipment
995,Inspect locomotives or other railway equipment
996,Test fire protection equipment and systems
997,Install fire protection equipment and systems
998,Maintain knowledge of aircraft specifications and flight safety procedures
999,Evaluate characteristics of products
1000,Maintain test equipment
1001,Examine condition of property or products
1002,Inspect facilities or equipment to ensure specifications are met
1003,Inspect facilities or sites to determine if they meet specifications or standards
1004,Test products for functionality or quality
1005,Inspect products or operations to ensure that standards are met
1006,Inspect completed work to ensure proper installation
1007,Inspect completed work to ensure proper functioning
1008,Inspect work sites to determine condition or necessary repairs
1009,"Inspect facilities, equipment or supplies to ensure conformance to standards"
