id,skill
0,Analyse data to assess operational or project effectiveness
1,Analyse data to inform operational decisions or activities
2,Analyse data to inform staffing decisions
3,Analyse data to identify or resolve operational problems
4,Calculate data to inform organisational operations
5,Conduct quantitative failure analyses of operational data
6,Analyse operational data
7,Evaluate applicable laws and regulations to determine impact on organisational activities
8,Analyse data to determine project feasibility
9,"Analyse operational data to evaluate operations, processes or products"
10,"Manage operations, research or logistics projects"
11,Manage inventories of products or organisational resources
12,Interpret research or operational data
13,Record research or operational data
14,Analyse operational or research data
15,Research industrial processes or operations
16,Manage scientific or technical project resources
17,Conduct scientific research of organisational behaviour or processes
18,Analyse market research data
19,Analyse consumer trends
20,Analyse market conditions or trends
21,Monitor market conditions or trends
22,"Forecast economic, political, social or financial trends"
23,Conduct market research
24,Analyse industry trends
25,Analyse market or customer related data
26,Develop pricing forecasts and models
27,Analyse data to identify trends or relationships among variables
28,Conduct research on social issues
29,Analyse geological or geographical data
30,Develop methods of social or economic research
31,Plan social sciences research
32,Research social issues
33,Analyse health-related data
34,Develop theories or models of social phenomena
35,Apply machine learning techniques to data
36,"Prepare materials for preservation, storage or display"
37,Evaluate characteristics of archival or historical objects
38,Conduct historical research
39,Collect archival data
40,Document test results
41,Collect samples of materials or products for testing
42,Collect samples for analysis or testing
43,"Test materials, solutions or samples"
44,Evaluate data quality
45,Analyse test or validation data
46,Analyse test results
47,Examine documents to verify adherence to requirements
48,"Proofread documents, records or other files to ensure accuracy"
49,Verify accuracy of data
50,Examine personal documentation to ensure that it is valid
51,Enter information into databases or software programs
52,Load digital images onto computers or websites
53,Create databases to store electronic data
54,Update computer database information
55,Operate laboratory equipment to analyse medical samples
56,Analyse laboratory specimens to detect abnormalities or other problems
57,Analyse laboratory findings
58,Confer with peers to accomplish work
59,Liaise between departments or other groups to improve function or communication
60,Advise others on business or operational matters
61,Establish interpersonal business relationships to facilitate work activities
62,Confer with staff to coordinate business operations
63,"Discuss business strategies, practices or policies with managers"
64,Collaborate with others to resolve information technology issues
65,Confer with others to conduct or arrange operational activities
66,Explain technical product or service information to customers
67,Communicate work orders or plans to co-workers
68,Explain project details to the general public
69,Discuss problems or issues with supervisors
70,Coordinate project activities with other staff or departments
71,Present research results
72,Provide technical information or assistance to public
73,Confer with other staff to resolve design or operational problems
74,Communicate with other construction or mining staff to discuss project details
75,Confer with co-workers or internal stakeholders to coordinate operational activities
76,Confer with customers or designers to determine order specifications
77,Report information to managers or other staff
78,Discuss production content and progress with others
79,Confer with managers to make operational decisions
80,Advise customers on technical or procedural issues
81,Develop working relationships with others to facilitate program activities
82,Communicate project information to others
83,Communicate with management or other staff to resolve problems
84,Collaborate with others to determine production details
85,Advise clients on security requirements and design security measures
86,Confer with colleagues to formulate positions and strategies pertaining to pending issues
87,"Negotiate with colleagues or members of other political parties in order to reconcile differing interests, and to create policies and agreements"
88,Advise others on the development or use of new technologies
89,Advise others on ways to improve processes or products
90,Coordinate with external parties to exchange information
91,Represent the organisation in external relations
92,Coordinate operational activities with external stakeholders
93,Communicate with government agencies
94,Collaborate with others in marketing activities
95,Collaborate with others to develop or implement marketing strategies
96,Develop collaborative relationships between departments or with external organisations
97,Work with Indigenous populations to protect heritage sites
98,"Represent the government at local, national, and international meetings and conferences"
99,"Hear testimony from constituents, representatives of interest groups, board and commission members, and others with an interest in bills or issues under consideration"
100,"Attend receptions, dinners, and conferences to meet people, exchange views and information, and develop working relationships"
101,"Interview employees, customers or others to collect information"
102,Serve on institutional or departmental committees
103,Confer with clients to determine needs
104,Interview clients to gather financial information
105,Discuss designs or plans with clients
106,"Interview clients to gather information about their backgrounds, needs or progress"
107,Exchange information with colleagues
108,Read work orders or descriptions of problems to determine repairs or modifications needed
109,"Advise others on issues related to repairs, installation or equipment design"
110,Confer with co-workers to resolve equipment problems
111,Confer with other professionals to plan patient care
112,Confer with court staff to clarify information
113,Notify others of equipment repair or maintenance needs
114,Confer with others to coordinate maintenance or cleaning activities
115,Confer with others to resolve production problems or equipment malfunctions
116,Confer with clients to exchange information
117,Communicate with co-workers to coordinate installations or repairs
118,Notify others of equipment problems
119,Advise real estate clients
120,Conduct opinion surveys or needs assessments
121,Advise others on matters of public policy
122,"Make decisions that balance the perspectives of private citizens, public officials, and party leaders"
123,Operate still or video cameras or related equipment
124,Set up still or video cameras or related equipment
125,"Operate communications, transmissions or broadcasting equipment"
126,Operate digital imaging equipment
127,Operate photographic developing or print production equipment
128,Operate audio-visual equipment
129,Operate communications equipment or systems
130,Apply decorative colouring to photographs or printed materials
131,"Operate control consoles for sound, lighting or video"
132,Operate audio recording equipment
133,"Document events or evidence, using photographic or audio-visual equipment"
134,Monitor broadcasting operations to ensure proper functioning
135,Mix sound inputs
136,Record images needed to address work issues
137,Set up and operate lighting equipment
138,Collaborate with others to determine technical details of productions
139,"Advise educators on curricula, instructional methods or policies"
140,Collaborate with technical specialists to resolve design or development problems
141,Discuss design or technical features of goods or services with technical staff
142,Confer with technical staff to prepare designs or operational plans
143,"Communicate technical information to suppliers, contractors or regulatory agencies"
144,Provide technical guidance to other staff
145,Coordinate cross-disciplinary research programs
146,Collaborate with other teaching professionals to develop educational programs
147,Advise students on academic or career matters
148,Collaborate with other agencies and institutions to coordinate educational matters
149,Collaborate with others to determine design specifications or details
150,Assist other educational professionals with projects or research
151,Collaborate with other professionals to develop education or assistance programs
152,Counsel clients regarding educational or vocational issues
153,Collaborate with others to develop or refine designs
154,Teach life skills or strategies to clients or their families
155,Speak to students to encourage and support the development of future political leaders
156,Interview others for news or entertainment purposes
157,"Collect information from people through observation, interviews or surveys"
158,Interview people to gather information about criminal activities
159,Interview people to obtain information about actions or status of individuals
160,Negotiate agreements to resolve disputes
161,Mediate disputes
162,Arbitrate disputes between parties to resolve legal conflicts
163,Resolve interpersonal conflicts
164,Coach others
165,Collaborate with health care professionals to plan or provide treatment
166,Inform medical professionals regarding patient conditions and care
167,Collaborate with other professionals to assess client needs or plan treatments
168,Communicate test or assessment results to medical professionals
169,Supervise activities of other legal staff
170,Provide information to co-workers
171,Distribute materials to employees or customers
172,Relay information between staff
173,Signal others to coordinate work activities
174,Communicate with others to coordinate material handling or movement
175,Communicate situation details to appropriate personnel
176,Communicate with others to coordinate activities
177,Advise others on educational and student wellbeing matters
178,Advise others on social or educational issues
179,"Support individuals with diverse needs to understand, access and utilise information or services"
180,"Deliver culturally appropriate programs, policies or services"
181,"Act as an advocate or communicator regarding the cultural, diversity or accessibility needs of others"
182,"Maintain a working understanding of the cultural, diversity and accessibility needs of others, and how this applies to the role"
183,"Deliver inclusive and accessible programs, policies or services"
184,"Develop programs, policies or services that are culturally appropriate"
185,"Apply knowledge, understanding and respect of culturally significant sites or objects"
186,"Prepare financial documents, reports or budgets"
187,Analyse financial records to improve budgeting or planning
188,Develop financial or business plans
189,Prepare financial documents
190,Develop financial plans for clients
191,"Analyse budgetary, accounting or business data"
192,Develop business or financial information systems
193,Implement financial decisions
194,Develop financial analysis methods
195,Conduct financial audits
196,Develop organisational policies or programs
197,Implement organisational process or policy changes
198,Develop organisational goals or objectives
199,Recommend organisational process or policy changes
200,Develop sustainable organisational policies or practices
201,Evaluate program effectiveness
202,Establish organisational guidelines or policies
203,"Develop policies or procedures for archives, museums or libraries"
204,Develop promotional strategies for religious organisations
205,"Plan conferences, programs or special events"
206,Develop plans for programs or services
207,Direct administrative or support services
208,"Direct organisational operations, projects or services"
209,"Direct sales, marketing or customer service activities"
210,Monitor facilities or operational systems
211,Manage control system activities in organisations
212,Direct productions or performances
213,Direct activities of staff
214,Direct department activities
215,Coordinate flight control or management activities
216,Direct operations of correctional facilities
217,Coordinate operational activities
218,Direct emergency management activities
219,Direct quality control activities
220,Monitor recreational facility operations
221,Direct criminal investigations
222,Direct security operations
223,Operate and maintain car wash facilities
224,Prepare operational budgets
225,Determine resource needs
226,Approve expenditures
227,Manage organisational or project budgets
228,Coordinate resource procurement activities
229,Manage budgets for appropriate resource allocation
230,Estimate costs for projects or productions
231,Estimate operational costs
232,Prepare project budgets
233,Estimate time or monetary resources needed to complete projects
234,Manage organisational or program finances
235,"Plan and manage, and analyse costs and benefits of, proposed designs or projects"
236,Direct financial operations
237,Monitor flow of cash or other resources
238,Authorise financial actions
239,Direct fundraising or financing activities
240,Assess financial status of clients
241,Examine financial records
242,Gather financial records
243,Reconcile records of sales or other financial transactions
244,Analyse financial information
245,Calculate financial data
246,Monitor financial information
247,Analyse business or financial data
248,Calculate tax information
249,Examine financial records or processes
250,Manage financial activities of the organisations
251,Monitor financial indicators
252,Balance receipts
253,"Negotiate contracts for transportation, distribution or logistics services"
254,Negotiate sales or lease agreements for goods or services
255,Negotiate contracts with clients or service providers
256,Negotiate for services
257,Negotiate prices or other sales terms
258,Prepare sales or other contracts
259,Negotiate purchases or contracts
260,Determine pricing or monetary policies
261,Collect payments for goods or services
262,Disburse funds from clients' accounts to creditors
263,Compute debt repayment schedules
264,Execute sales or other financial transactions
265,Submit financial applications
266,Authorise payments to settle legal disputes
267,Process medical billing information
268,Operate cash registers
269,Process customer bills or payments
270,Collect fares or payment from customers
271,Manage budgets for personal services operations
272,"Collect deposits, payments or fees"
273,Prepare cash for deposit or disbursement
274,Negotiate financial arrangements
275,"Issue money, credit or vouchers"
276,"Pay charges, fees or taxes"
277,Analyse financial records to improve efficiency
278,Conduct financial or regulatory audits
279,Verify accuracy of records
280,Verify accuracy of financial information
281,Verify customer credit information
282,Maintain financial or account records
283,Check data for recording errors
284,Verify accuracy of financial or transactional data
285,Obtain personal or financial information about customers or applicants
286,Analyse financial records or reports to determine state of operations
287,Examine financial records to ensure compliance with policies or regulations
288,Plan facility layouts or designs
289,Plan work procedures
290,Determine appropriate locations for operations or installations
291,Direct design or development activities
292,Coordinate design activities
293,Coordinate construction project activities
294,Plan work operations
295,"Procure materials, equipment or other resources"
296,Procure goods or services
297,Procure stocks of merchandise or supplies
298,"Order materials, supplies, or equipment"
299,Procure supplies or equipment
300,Administer compensation or benefits programs
301,Review customer insurance information
302,Arrange insurance coverage
303,Assess or underwrite insurance claims
304,Estimate demand for goods or services
305,Determine the value of goods or services
306,Estimate costs or terms of sales
307,"Estimate costs of goods, services or materials"
308,Calculate costs of goods or services
309,Estimate costs of goods or services
310,"Assess the cost effectiveness of products, projects or services"
311,Develop business or market strategies
312,Identify strategic business investment opportunities
313,Develop business relationships
314,Monitor external affairs or events affecting business operations
315,Oversee business processes
316,Prepare business correspondence
317,Maintain knowledge of business operations
318,Assess risks to business operations
319,Establish business management methods
320,Measure effectiveness of business strategies or practices
321,Monitor business indicators
322,Monitor inventories
323,"Maintain inventories of materials, equipment or products"
324,Stock products or parts
325,Maintain the inventory of equipment
326,"Maintain food, drink or equipment inventories"
327,Maintain supply or equipment inventories
328,Stock medical or patient care supplies
329,Store items
330,"Stock supplies, merchandise, food or drink"
331,Inventory materials or equipment
332,Store supplies or goods in kitchens or storage areas
333,Collate or assemble product orders
334,"Ensure safe meat, dairy or produce storage"
335,Confer with others about financial matters
336,Interpret financial information for others
337,Explain financial information to customers
338,Discuss account status or activity with customers or patrons
339,Customise financial goods or services to meet customer needs
340,Advise others on financial matters
341,Educate clients on financial planning topics
342,Recommend investments to clients
343,Identify investment opportunities or strategies
344,"Establish standards for products, processes or procedures"
345,Determine operational criteria or specifications
346,Develop performance metrics or standards related to information technology
347,Prepare technical or operational reports
348,Interpret design or operational test results
349,Document design or operational test results
350,Perform clerical work in medical settings
351,Perform student enrolment or registration activities
352,Prepare procedural documents
353,Perform administrative or clerical tasks
354,Schedule appointments
355,Supervise clerical or administrative staff
356,Manage clerical or administrative activities
357,Prepare administrative documents
358,Obtain written authorisation to perform activities
359,Count finished products or work pieces
360,Prepare operational progress or status reports
361,Compile operational data
362,Model operational processes
363,Document organisational or operational procedures
364,Prepare operational reports or records
365,Record operational details of travel
366,Prepare operational reports
367,Schedule operational activities
368,Document operational activities
369,Document operational procedures
370,Determine operational procedures
371,Determine operational methods
372,Write operational reports
373,"Develop operating strategies, plans or procedures"
374,Develop organisational methods or procedures
375,Develop procedures to evaluate organisational activities
376,Develop guidelines for system implementation
377,Establish operational policies
378,Plan flight operations
379,Develop diagrams or flow charts of system operation
380,Plan production or operational procedures or sequences
381,Negotiate project specifications
382,Develop detailed project plans
383,Prepare production storyboards
384,Determine construction project layouts
385,Prepare detailed work plans
386,Estimate time requirements for development or production projects
387,Lay out work according to specifications
388,Manage project risk
389,Schedule activities or facility use
390,Coordinate activities of production staff
391,Coordinate logistics for productions or events
392,"Coordinate activities with suppliers, contractors, clients, or other departments"
393,Mix substances or compounds needed for work activities
394,Arrange facility schedules
395,Coordinate logistics or other business operations
396,Distribute supplies to workers
397,Select resources needed to accomplish tasks
398,Prepare tests
399,Develop testing routines or procedures
400,Administer standardised physical or psychological tests
401,Develop tools to diagnose or assess needs
402,Develop information communication procedures
403,Identify information technology project resource requirements
404,Coordinate reporting or editing activities
405,Document design or development procedures
406,Develop models of information or communications systems
407,Document network-related activities or tasks
408,Code data or other information
409,Develop data analysis or data management procedures
410,Determine appropriate methods for data analysis
411,Develop procedures for data entry or processing
412,Develop procedures for data management
413,Develop database parameters or specifications
414,"Build models, patterns or templates"
415,Draw detailed or technical illustrations
416,Create physical models or prototypes
417,"Construct patterns, templates or other work aids"
418,Design templates or patterns
419,Draw guide lines or markings on materials or work pieces using patterns or other references
420,"Engrave or etch designs, text or other markings onto materials, work pieces or products"
421,Prepare drawings or diagrams of goods or services
422,Design layouts for print publications
423,"Design layout of art or product exhibits, displays or promotional materials"
424,Create diagrams or blueprints for work pieces or products
425,Design furniture
426,Design energy production or management equipment or systems
427,Create graphical representations of industrial production systems
428,Create graphical representations of energy production systems
429,Direct industrial production activities
430,Direct operational or production activities
431,Direct energy production or management activities
432,Direct technical activities or operations
433,Devise research or testing protocols
434,Analyse project data to determine specifications or requirements
435,Evaluate project designs to determine adequacy or feasibility
436,Evaluate construction projects to determine compliance with external standards or regulations
437,Develop specifications for new products or processes
438,Evaluate plans or specifications to determine technological or environmental implications
439,Evaluate technical data to determine effect on designs or plans
440,Implement design or process improvements
441,Evaluate designs or specifications to ensure quality
442,Determine design criteria or specifications
443,Evaluate projects to determine compliance with technical specifications
444,Evaluate reports or designs to determine work needs
445,Read work orders or other instructions to determine product specifications or materials requirements
446,Review work orders or schedules to determine operations or procedures
447,Read work orders to determine material or setup requirements
448,Communicate organisational policies and procedures
449,Manage human resources activities
450,Monitor performance of organisational members or partners
451,Maintain staff records
452,Conduct surveys in organisations
453,Perform human resources activities
454,Advise others on human resources topics
455,Arrange collective bargaining agreements
456,Gather organisational performance information
457,Monitor organisational processes
458,Prepare staff schedules or work assignments
459,Assign duties or work schedules to employees
460,Participate in staffing decisions
461,Prepare activity or work schedules
462,Receive information or instructions for performing work assignments
463,Prepare staff schedules
464,Plan employee work schedules
465,Document work hours or activities
466,Resolve employee or contractor problems
467,Negotiate labour disputes
468,Conduct employee training programs
469,Train staff to improve their skills
470,Train sales staff
471,Train staff members
472,Train transportation or material moving staff
473,Train staff on proper operational procedures
474,Conduct health or safety training programs
475,Train caregivers or other non-medical staff
476,Train staff members in social services skills
477,Train construction or mining staff
478,Train others on work processes
479,Train service staff
480,Train staff
481,Train others in operational procedures
482,Instruct staff in work policies or procedures
483,Train managerial staff
484,Train staff in organisational or compliance procedures
485,Train employees in proper work procedures
486,Provide safety training or demonstrations
487,Hire staff
488,Recruit staff
489,Conduct eligibility or selection interviews
490,Audition or interview potential performers or staff members
491,"Select staff, team members or performers"
492,Administer staff recruitment or hiring activities
493,Coordinate recruitment activities
494,"Hire farming, fishing or forestry workers"
495,Supervise employees
496,Supervise information technology staff
497,Supervise sales or support staff
498,Evaluate performance of educational staff
499,Supervise trainees
500,Supervise scientific or technical staff
501,Supervise engineering or other technical staff
502,Train staff in technical or scientific procedures
503,Supervise service workers
504,Instruct workers to use equipment or perform technical procedures
505,Supervise production or support staff
506,Provide mentorship and guidance to staff
507,Provide leadership to align operational activities with the organisation’s vision and goals
508,Maintain knowledge of current developments in area of expertise
